{
  "systemId": "11111111-1111-4111-8111-111111111111",
  "name": "Portal-Prod",
  "authorizationStatus": "conditionallyAuthorized",
  "components": [
    {"name": "WebTier", "type": "application", "description": "Web servers (containerized)"},
    {"name": "CacheTier", "type": "application", "description": "New Redis cache"}
  ]
}
